name,symbol,atomic_number,atomic_volume,atomic_weight,mass_number,group,period,series,block,electrons,protons,neutrons,cas,discoverers,discovery_location,discovery_year,description,name_origin,sources,uses,mendeleev_number,story,country,image,formulas,formulas_cid,formula_links
Lead,Pb,82,18.3,207.2,208,"<Group(symbol=IVA, name=Carbon group)>",6,Poor metals,p,82,82,126,7439-92-1,Known to the ancients.,,,"Heavy dull grey ductile metallic element, belongs to group 14. Used in building construction, lead-place accumulators, bullets and shot, and is part of solder, pewter, bearing metals, type metals and fusible alloys.",Anglo-Saxon: lead; symbol from Latin: plumbum.,Found most often in ores called galena or lead sulfide (PbS). Some is found in its native state.,"Used in solder, shielding against radiation and in batteries.",91,"Lead has been mined for more than 6,000 years, and the metal and its compounds have been used throughout history. Small lead nuggets have been found in pre-Columbian Peru, Yucatan, and Guatemala. The Greeks mined lead on a large scale from 650 onwards and not only knew how to obtain the metal but how to covert this to white lead. Because of its superb covering power, this was the basis of paints for more than 2000 years, until the middle of the last century. The Romans employed lead on a large scale, mining it mainly in Spain and Britain, and using it also for water pipes, coffins, pewter tableware, and to debase their silver coinage. While its mining declined in the Dark Ages it reappeared in Medieval times and found new uses, such as pottery glazes, bullets, and printing type. In the last century it was a fuel additive.",ancient,http://res.cloudinary.com/dc2o3efbz/image/upload/v1480905633/elements/lead.jpg,"['PbO', 'PbO2', 'Pb(NO3)2']","[5794, 14827, 16683880]","['/watch?v=KeDV3zmowwM&pp=ygURaG93IHRvIGNyZWF0ZSBQYk8%3D', '/watch?v=n9ADhpa9zSo&pp=ygUSaG93IHRvIGNyZWF0ZSBQYk8y', '""""']"
Bismuth,Bi,83,21.3,208.9804,209,"<Group(symbol=VA, name=Pnictogens)>",6,Poor metals,p,83,83,126,7440-69-9,Known to the ancients.,,,"White crystalline metal with a pink tinge, belongs to group 15. Most diamagnetic of all metals and has the lowest thermal conductivity of all the elements except mercury. Lead-free bismuth compounds are used in cosmetics and medical procedures. Burns in the air and produces a blue flame. In 1753, C.G. Junine first demonstrated that it was different from lead.","German: bisemutum, (white mass), Now spelled wismut.",It can be found free in nature and in minerals like bismuthine (Bi2O3) and in bismuth ochre (Bi2O3),Main use is in pharmaceuticals and low melting point alloys used as fuses.,97,"Bismuth was discovered by an unknown alchemist around 1400 AD. Later that century it was alloyed with lead to make cast type for printers and decorated caskets were being crafted in the metal. Bismuth was often confused with lead; it was likewise a heavy metal and melted at a relatively low temperature making it easy to work. Georgius Agricola in the early 1500s speculated that it was a distinctly different metal, as did Caspar Neuman in the early 1700s, but proof that it was so finally came in 1753 thanks to the work of Claude-François Geoffre. Bismuth was used as an alloying metal in the bronze of the Incas of South America around 1500 AD. Bismuth was not mined as ore but appears to have occurred as the native metal.",ancient,http://res.cloudinary.com/dc2o3efbz/image/upload/v1480905670/elements/bismuth.jpg,[],[],[]
Polonium,Po,84,22.7,209.0,186,"<Group(symbol=VIA, name=Chalcogens)>",6,Metalloids,p,84,84,102,7440-08-6,Pierre and Marie Curie,France,1898.0,"Rare radioactive metallic element, belongs to group 16 of the periodic table. Over 30 known isotopes exist, the most of all elements. Po-209 has a half-life of 103 years. Possible uses in heating spacecraft. Discovered by Marie Curie in 1898 in a sample of pitchblende.","Named for Poland, native country of Marie Curie.",Occurs in pitchblende from decay of bismuth.,"Used in industrial equipment that eliminates static electricity caused by such processes as rolling paper, wire, and sheet metal.",103,"Uranium ores contain minute traces of polonium at levels of parts per billion. Despite this, in 1898 Marie Curie and husband Pierre Curie extracted some from pitchblende (uranium oxide, U3O8) after months of painstaking work. The existence of this element had been forecast by the Mendeleev who could see from his periodic table that there might well be the element that followed bismuth and he predicted it would have an atomic weight of 212. The Curies had extracted the isotope polonium-209 and which has a half-life of 103 years. Before the advent of nuclear reactors, the only source of polonium was uranium ore but that did not prevent its being separated and used in anti-static devices. These relied on the alpha particles that polonium emits to neutralise electric charge.",France,http://res.cloudinary.com/dc2o3efbz/image/upload/v1480905692/elements/polonium.jpg,"['[Xe] 4f14 5d10 6s2 6p4', 'PoO2', 'PoCl2']","['Failed to retrieve data', 16745749, 22445]","['""""', '/watch?v=iiR2IN5_Br4&pp=ygUSaG93IHRvIGNyZWF0ZSBQb08y', '""""']"
Astatine,At,85,,210.0,191,"<Group(symbol=VIIA, name=Halogens)>",6,Halogens,p,85,85,106,7440-68-8,"D.R.Corson, K.R.MacKenzie, E.Segré",United States,1940.0,"Radioactive halogen element. Occurs naturally from uranium and thorium decay. At least 20 known isotopes. At-210, the most stable, has a half-life of 8.3 hours. Synthesized by nuclear bombardment in 1940 by D.R. Corson, K.R. MacKenzie and E. Segre at the University of California.",Greek: astatos (unstable).,Does not occur in nature. Similar to iodine. Produced by bombarding bismuth with alpha particles.,Since its isotopes have such short half-lives there are no commercially significant compounds of astatine.,110,"In 1939, two groups came near to discovering this element in mineral samples. Horia Hulubei and Yvette Cauchois analysed mineral samples using a high-resolution X-ray apparatus and thought they had detected it. Meanwhile, Walter Minder observed the radioactivity of radium and said it appeared have another element present. He undertook chemical tests which suggested it was like iodine. Element 85 was convincingly produced for the first time at the University of California in 1940 by Dale R. Corson, K.R. Mackenzie, and Emilio Segré. Their astatine was made by bombarding bismuth with alpha particles. Although they reported their discovery, they were unable to carry on with their research due to World War II and the demands of the Manhattan project which diverted all researchers of radioactive materials towards the making of nuclear weapons.",USA,http://res.cloudinary.com/dc2o3efbz/image/upload/v1480905845/elements/astatine-300x225.jpg,"['At2', 'AtCl', 'AtH']","[104931, 5459963, 'Failed to retrieve data']","['""""', '""""', '""""']"
Radon,Rn,86,,222.0,193,"<Group(symbol=VIIIA, name=Noble gases)>",6,Noble gases,p,86,86,107,10043-92-2,Fredrich Ernst Dorn,Germany,1898.0,"Colorless radioactive gaseous element, belongs to the noble gases. Of the twenty known isotopes, the most stable is Rn-222 with a half-life of 3.8 days. Formed by the radioactive decay of Radium-226. Radon itself decays into Polonium. Used in radiotherapy. As a noble gas, it is effectively inert, though radon fluoride has been synthesized. First isolated in 1908 by Ramsey and Gray.","Variation of the name of another element, radium.",Formed from the decay of radium in the earths crust.,Used to treat some forms of cancer.,117,"In 1899, Ernest Rutherford and Robert B. Owens detected a radioactive gas being released by thorium. That same year, Pierre and Marie Curie detected a radioactive gas emanating from radium. In1900, Friedrich Ernst Dorn at Halle, Germany, noted that a gas was accumulating inside ampoules of radium. They were observing radon. That from radium was the longer-lived isotope radon-222 which has a half-life 3.8 days, and was the same isotope which the Curies has observed. The radon that Rutherford detected was radon-220 with a half-life of 56 seconds. In 1900, Rutherford devoted himself to investigating the new gas and showed that it was possible to condense it to a liquid. In 1908, William Ramsay and Robert Whytlaw-Gray at University College, London, collected enough radon to determine its properties and reported that it was the heaviest gas known.",Germany,http://res.cloudinary.com/dc2o3efbz/image/upload/v1480905721/elements/radon.jpg,[],[],[]
Francium,Fr,87,,223.0,197,"<Group(symbol=IA, name=Alkali metals)>",7,Alkali metals,s,87,87,110,7440-73-5,Marguerite Derey,France,1939.0,"Radioactive element, belongs to group 1 of the periodic table. Found in uranium and thorium ores. The 22 known isotopes are all radioactive, with the most stable being Fr-223. Its existence was confirmed in 1939 by Marguerite Perey.","Named for France, the nation of its discovery.",Formed by decay of actinium. Chemical properties similar to cesium. Decays to radium or astatine.,Since its isotopes have such short half-lives there are no commercially significant compounds of francium.,6,"Mendeleev said there should be an element like caesium waiting to be discovered. Consequently, there were claims, denials, and counterclaims by scientists who said they had found it. During the 1920s and 30s, these claims were made on the basis of unexplained radioactivity in minerals, or new lines in their X-ray spectra, but all eventually turned out not to be evidence of element 87. Francium was finally discovered in 1939 by Marguerite Perey at the Curie Institute in Paris. She had purified a sample of actinium free of all its known radioactive impurities and yet its radioactivity still indicated another element was present, and which she rightly deduced was the missing element 87. Others challenged her results too, and it was not until after World War II that she was accepted as the rightful discoverer in 1946.",France,http://res.cloudinary.com/dc2o3efbz/image/upload/v1480905808/elements/francium.jpg,[],[],[]
Radium,Ra,88,45.0,226.0,201,"<Group(symbol=IIA, name=Alkaline earths)>",7,Alkaline earth metals,s,88,88,113,7440-14-4,Pierre and Marie Curie,France,1898.0,"Radioactive metallic transuranic element, belongs to group 2 of the periodic table. Most stable isotope, Ra-226 has a half-life of 1602 years, which decays into radon. Isolated from pitchblende in 1898 Marie and Pierre Curie.",Latin: radius (ray).,Found in uranium ores at 1 part per 3 million parts uranium.,Used in treating cancer because of the gamma rays it gives off.,10,"Radium was discovered in 1898 by Marie Curie and Pierre Curie. They managed to extract 1 mg of radium from ten tonnes of the uranium ore pitchblende (uranium oxide, U3O8), a considerable feat, given the chemically methods of separation available to them. They identified that it was a new element because its atomic spectrum revealed new lines. Their samples glowed with a faint blue light in the dark, caused by the intense radioactivity exciting the surrounding air. The metal itself was isolated by Marie Curie and André Debierne in 1911, by means of the electrolysis of radium chloride. At Debierne’s suggestion, they used a mercury cathode in which the liberated radium dissolved. This was then heated to distil off the mercury leaving the radium behind.",France,http://res.cloudinary.com/dc2o3efbz/image/upload/v1480905917/elements/radium-glow.jpg,[],[],[]
Actinium,Ac,89,22.54,227.0,205,"<Group(symbol=IIIB, name=)>",7,Actinides,d,89,89,116,7440-34-8,André Debierne,France,1899.0,"Silvery radioactive metallic element, belongs to group 3 of the periodic table. The most stable isotope, Ac-227, has a half-life of 217 years. Ac-228 (half-life of 6.13 hours) also occurs in nature. There are 22 other artificial isotopes, all radioactive and having very short half-lives. Chemistry similar to lanthanumpy. Used as a source of alpha particles. Discovered by A. Debierne in 1899.","Greek: akis, aktinos (ray).","Extremely rare, found in all uranium ores. Usually obtained by treating radium with neutrons in a reactor.",It has no significant commercial applications.,14,"This element was discovered in 1899 by André Debierne at Paris. He extracted it from the uranium ore pitchblende (uranium oxide, U3O8) in which it occurs in trace amounts. In 1902, Friedrich Otto Giesel independently extracted it from the same mineral and, unaware it was already known, gave it the named emanium. Actinium extracted from uranium ores is the isotope actinium-227 which has half-life of 21.7 years. It occurs naturally as one of the sequence of isotopes that originate with the radioactive decay of uranium-235. A tonne of pitchblende contains around 150 mg of actinium.",France,http://res.cloudinary.com/dc2o3efbz/image/upload/v1480906342/elements/actinium.jpg,"['C2H3O2-', 'C2H4O2', 'C2H3NaO2']","['Failed to retrieve data', 176, 517045]","['/watch?v=TvOJSZLqcgY&pp=ygUVaG93IHRvIGNyZWF0ZSBDMkgzTzIt', '""""', '/watch?v=lGm9eGny7QM']"
Thorium,Th,90,19.8,232.0377,232,,7,Actinides,f,90,90,142,7440-29-1,Jöns Berzelius,Sweden,1828.0,"Grey radioactive metallic element. Belongs to actinoids. Found in monazite sand in Brazil, India and the US. Thorium-232 has a half-life of 1.39x10^10 years. Can be used as a nuclear fuel for breeder reactors. Thorium-232 captures slow Neutrons and breeds uranium-233. Discovered by Jons J. Berzelius in 1829.","Named for Thor, Norse god of thunder.",Found in various minerals like monazite and thorite.,"Used in making strong alloys. Also in ultraviolet photoelectric cells. It is a common ingredient in high-quality lenses. Bombarded with neutrons make uranium-233, a nuclear fuel.",16,"In 1829, Jöns Jakob Berzelius of the Royal Karolinska Institute, Stockholm extracted thorium from a rock specimen sent to him by an amateur mineralogist who had discovered it near Brevig and realised that it had not previously been reported. The mineral turned out to be thorium silicate, and it is now known as thorite. Berzelius even produced a sample of metallic thorium by heating thorium fluoride with potassium, and confirmed it as a new metal. The radioactivity of thorium was first demonstrated in 1898 by Gerhard Schmidt and confirmed by Marie Curie. Thorium, like uranium, survives on Earth because it has isotopes with long half-lives, such as the predominant one, thorium-232, whose half life is 14 billion years.",Sweden,http://res.cloudinary.com/dc2o3efbz/image/upload/v1480906354/elements/thorium.jpg,"['ThO2', 'ThF4', 'ThCl4']","[14808, 5460747, 66209]","['/watch?v=QjTyDpPkD3A&pp=ygUSaG93IHRvIGNyZWF0ZSBUaE8y', '""""', '""""']"
Protactinium,Pa,91,15.0,231.03588,231,,7,Actinides,f,91,91,140,7440-13-3,"Fredrich Soddy, John Cranston, Otto Hahn, Lise Meitner",England/France,1917.0,"Radioactive metallic element, belongs to the actinoids. The most stable isotope, Pa-231 has a half-life of 2.43*10^4 years. At least 10 other radioactive isotopes are known. No practical applications are known. Discovered in 1917 by Lise Meitner and Otto Hahn.",Greek: proto and actinium (parent of actinium); it forms actinium when it radioactively decays.,"Does not occur in nature. Found among fission products of uranium, thorium, and plutonium.",It has no significant commercial applications.,18,"Mendeleev said there should be an element between thorium and uranium, but it evaded detection. Then, in 1900, William Crookes separated an intensely radioactive material from uranium, but did not identify it. In 1913, Kasimir Fajans and Otto Göhring showed that this new element decayed by beta-emission and it existed only fleetingly. We now know it is a member of the sequence of elements through which uranium decays. It was the isotope protactinium-234, which has a half-life of 6 hours 42 minutes. A longer-lived isotope was separated from the uranium ore pitchblende (uranium oxide, U3O8) in 1918 by Lise Meitner at the Kaiser-Wilhelm Institute in Berlin. This was the longer-lived isotope protactinium-231, also coming from uranium, and its half-life is 32,500 years. In 1934, Aristid von Grosse reduced protactinium oxide to protactinium metal by decomposing its iodide (PaF5) on a heated filament.",UK,http://res.cloudinary.com/dc2o3efbz/image/upload/v1480906385/elements/protactinium-231.jpg,"['PaO2', 'PaCl4', 'PaCl5']","[10197600, 104811, 24817]","['""""', '""""', '""""']"
Uranium,U,92,12.5,238.02891,238,,7,Actinides,f,92,92,146,7440-61-1,Martin Klaproth,Germany,1789.0,"White radioactive metallic element belonging to the actinoids. Three natural isotopes, U-238, U-235 and U-234. Uranium-235 is used as the fuel for nuclear reactors and weapons. Discovered by Martin H. Klaproth in 1789.",Named for the planet Uranus.,"Occurs in many rocks, but in large amounts only in such minerals as pitchblende and carnotite.",For many centuries it was used as a pigment for glass. Now it is used as a fuel in nuclear reactors and in bombs.,20,"In the Middle Ages, the mineral pitchblende (uranium oxide, U3O8) sometimes turned up in silver mines, and in 1789 Martin Heinrich Klaproth of Berlin investigated it. He dissolved it in nitric acid and precipitated a yellow compound when the solution was neutralised. He realised it was the oxide of a new element and tried to produce the metal itself by heating the precipitate with charcoal, but failed. It fell to Eugène Peligot in Paris to isolate the first sample of uranium metal which he did in 1841, by heating uranium tetrachloride with potassium. The discovery that uranium was radioactive came only in 1896 when Henri Becquerel in Paris left a sample of uranium on top of an unexposed photographic plate. It caused this to become cloudy and he deduced that uranium was giving off invisible rays. Radioactivity had been discovered.",Germany,http://res.cloudinary.com/dc2o3efbz/image/upload/v1480906424/elements/uranium.jpg,"['UO2', 'U3O8', 'UF6']","[24968, 166636, 24560]","['/watch?v=99CyY4VdrGc&pp=ygURaG93IHRvIGNyZWF0ZSBVTzI%3D', '/watch?v=7CdkWTn6qCs&pp=ygUSaG93IHRvIGNyZWF0ZSBVM084', '/watch?v=3qmPZ0dlLEo&pp=ygURaG93IHRvIGNyZWF0ZSBVRjY%3D']"
Neptunium,Np,93,21.1,237.0,219,,7,Actinides,f,93,93,126,7439-99-8,"E.M. McMillan, P.H. Abelson",United States,1940.0,"Radioactive metallic transuranic element, belongs to the actinoids. Np-237, the most stable isotope, has a half-life of 2.2*10^6 years and is a by product of nuclear reactors. The other known isotopes have mass numbers 229 through 236, and 238 through 241. Np-236 has a half-life of 5*10^3 years. First produced by Edwin M. McMillan and P.H. Abelson in 1940.",Named for the planet Neptune.,Produced by bombarding uranium with slow neutrons.,It has no significant commercial applications.,22,"In early 1934, Enrico Fermi in Italy tried to produce elements 93 and 94 by bombarding uranium with neutrons, and claimed success. Ida Tacke-Noddack questioned Fermi’s claim, pointing out he had failed to do a complete analysis, and all that he had found were fission products of uranium. (Fermi had in fact discovered nuclear fission but not realised it.) In 1938, Horia Hulubei and Yvette Cauchois claimed to have discovered element 93, but the claim was also criticised on the grounds that element 93 did not occur naturally. Neptunium was first made in 1940 by Edwin McMillan and Philip Abelson at Berkeley, California. It came from a uranium target that had been bombarded with slow neutrons and which then emitted unusual beta-rays indicating a new isotope. Abelson proved there was indeed a new element present.",USA,http://res.cloudinary.com/dc2o3efbz/image/upload/v1480906443/elements/neptunium.jpg,"['NpO2', 'NpF4', 'NpCl4']","[10128300, 22517, 24101478]","['/watch?v=znPiAeEg3OA&pp=ygUSaG93IHRvIGNyZWF0ZSBOcE8y', '""""', '""""']"
Plutonium,Pu,94,,244.0,221,,7,Actinides,f,94,94,127,7440-07-5,"G.T.Seaborg, J.W.Kennedy, E.M.McMillan, A.C.Wohl",United States,1940.0,"Dense silvery radioactive metallic transuranic element, belongs to the actinoids. Pu-244 is the most stable isotope with a half-life of 7.6*10^7 years. Thirteen isotopes are known. Pu-239 is the most important, it undergoes nuclear fission with slow neutrons and is hence important to nuclear weapons and reactors. Plutonium production is monitored down to the gram to prevent military misuse. First produced by Gleen T. Seaborg, Edwin M. McMillan, J.W. Kennedy and A.C. Wahl in 1940.",Named for the planet Pluto.,Found rarely in some uranium ores. Made by bombarding uranium with neutrons.,Used in bombs and reactors. Small quantities are used in thermo-electric generators.,24,"Plutonium was first made in December 1940 at Berkeley, California, by Glenn Seaborg, Arthur Wahl, Joseph Kennedy, and Edwin McMillan. They produced it by bombarding uranium-238 with deuterium nuclei (alpha particles). This first produced neptunium-238 with a half-life of two days, and this decayed by beta emission to form element 94 (plutonium). Within a couple of months element 94 had been conclusively identified and its basic chemistry shown to be like that of uranium. To begin with, the amounts of plutonium produced were invisible to the eye, but by August 1942 there was enough to see and weigh, albeit only 3 millionths of a gram. However, by 1945 the Americans had several kilograms, and enough plutonium to make three atomic bombs, one of which exploded over Nagasaki in August 1945.",USA,http://res.cloudinary.com/dc2o3efbz/image/upload/v1480906461/elements/plutonium.jpg,"['PuO2', 'PuCl3', 'PuF4']","[23941, 24387, 101540412]","['/watch?v=aI8VyCZlkwA&pp=ygUSaG93IHRvIGNyZWF0ZSBQdU8y', '/watch?v=aqPLU8ge-0w&pp=ygUTaG93IHRvIGNyZWF0ZSBQdUNsMw%3D%3D', '/watch?v=aI8VyCZlkwA&pp=ygUSaG93IHRvIGNyZWF0ZSBQdUY0']"
Americium,Am,95,20.8,243.0,223,,7,Actinides,f,95,95,128,7440-35-9,"G.T.Seaborg, R.A.James, L.O.Morgan, A.Ghiorso",United States,1945.0,"Radioactive metallic transuranic element, belongs to the actinoids. Ten known isotopes. Am-243 is the most stable isotope, with a half-life of 7.95*10^3 years. Discovered by Glenn T. Seaborg and associates in 1945, it was obtained by bombarding Uranium-238 with alpha particles.","Named for the American continent, by analogy with europium.",Produced by bombarding plutonium with neutrons.,Americium-241 is currently used in smoke detectors.,26,"This element was in fact discovered after curium, the element which follows it in the periodic table. However, it did once exist on Earth having been produced for millions of years in natural nuclear reactors in Oklo, Gabon. These ceased to function a billion years ago, and as the longest lived isotope is americium-247, with a half-life of 7370 years, none has survived to the present day. Americium was first made late in 1944 at the University of Chicago by a team which included Glenn Seaborg, Ralph James, Leon Morgan, and Albert Ghiorso. The americium was produced by bombarding plutonium with neutrons in a nuclear reactor. This produced isotope americium-241, which has a half-life of this is 432 years.",USA,http://res.cloudinary.com/dc2o3efbz/image/upload/v1480906461/elements/plutonium.jpg,[],[],[]
Curium,Cm,96,18.28,247.0,231,,7,Actinides,f,96,96,135,7440-51-9,"G.T.Seaborg, R.A.James, A.Ghiorso",United States,1944.0,"Radioactive metallic transuranic element. Belongs to actinoid series. Nine known isotopes, Cm-247 has a half-life of 1.64*10^7 years. First identified by Glenn T. Seaborg and associates in 1944, first produced by L.B. Werner and I. Perlman in 1947 by bombarding americium-241 with Neutrons. Named for Marie Curie.",Named in honor of Pierre and Marie Curie.,Made by bombarding plutonium with helium ions. So radioactive it glows in the dark.,It has no significant commercial applications.,28,"Curium was first made by the team of Glenn Seaborg, Ralph James, and Albert Ghiorso in 1944, using the cyclotron at Berkeley, California. They bombarded a piece of the newly discovered element plutonium (isotope 239) with alpha-particles. This was then sent to the Metallurgical Laboratory at the University of Chicago where a tiny sample of curium was eventually separated and identified. However, news of the new element was not disclosed until after the end of World War II. Most unusually, it was first revealed by Seaborg when he appeared as the guest scientist on a radio show for children on 11 November 1945. It was officially announced the following week.",USA,http://res.cloudinary.com/dc2o3efbz/image/upload/v1480906483/elements/curium-glow.jpg,[],[],[]
